doc_id	timestamp	notes
252	2020-05-27 00:11	肆虐全球，許多國家面臨防疫物資短缺問題，南韓有民眾不滿慶州市長朱洛榮無視民間物資缺乏，反而將大量物資捐給日本的兩個姊妹市，於
253	2020-05-27 00:06	希望能盡快將技術運用到公共場域，但目前並未透露進一步的計畫細節。請見，，。
254	2020-05-27 00:05	得勝利，屆時由立法會對國安相關條例進行改動的可能性將不復存在。第三個原因是全球忙於對抗，無暇關注。迪特，對港人來說，現在眼前只剩兩條路沉默地接受
255	2020-05-26 23:59	，是羅琳第一個與《哈利波特》無關的兒童讀物，她在十多年前為自己的孩子寫了這本書，決定在大流行期間出版。羅琳表示，這是為了處於封鎖狀態的兒童，或是在這些陌
256	2020-05-26 23:25	肆虐全球，中國政府持續強化外宣攻勢，並趁勢在全國人大強推港版國安法，引起國際社會強烈譴責；對此，中國駐法國大使館在推特發布美
257	2020-05-26 23:16	中國第十三屆第三次全國人民代表大會持續進行，中國國家主席習近平今天強調，防疫期間須做好國防及加強部署軍事武力。綜合外電報導，習近平今天在人民
258	2020-05-26 22:35	以《派遣女醫》成為日劇一姐，該劇收視向來長紅，幾季下來替電視台和米倉賺進大把銀子，但爆發後，米倉涼子已向電視台多次請辭，表示自己不想再演大門未知子，想要
259	2020-05-26 22:25	加拿大因應持續禁止聚集，有官員今天竟說，這段集會遊行被禁止的期間是建立油管的絕佳時機。綜合媒體報導，亞伯達省
260	2020-05-26 22:17	導致許多大型活動停辦，英國超跑製造商麥拉倫也因此受打擊，出於賽車比賽和製造、銷售活動在下暫
261	2020-05-26 22:06	日本政府在下大舉紓困，但生意大受打擊的風俗店卻因其資金來源多為黑社會、逃稅，以及職業歧視等因素，而遭政府拒絕紓困，使風俗店的
262	2020-05-26 21:57	近期歐美有數百起伴隨出現的神秘疾病兒童多重炎症綜合症，南韓在今日也出現例疑似個案，若是真的確診，可能將
263	2020-05-26 21:57	肆虐，經濟合作合作暨發展組織今天發佈最新報告，儘管目前個會員國中，尚有個國家尚未發佈第季經濟數據，不過仍可推
264	2020-05-26 21:45	市場對於重啟經濟抱持樂觀態度，再加上疫苗開發再傳利多，美股週二開盤勁揚，道瓊工業指數大漲超過點，標普指數更一舉站回
265	2020-05-26 21:30	俄羅斯總統普廷引用專家的意見宣布，俄國已過了的高峰期，他同時在會議上表示，先前延後的二戰勝利日閱兵，將改在
266	2020-05-26 21:19	台灣趨緩，中央流行指揮中心指揮官陳時中也宣布，口罩禁令預計解除，將可自由買賣。日本鄉民得知消息後開心直呼，台灣口罩比中
267	2020-05-26 21:18	國內日漸平穩，中央流行指揮中心今日宣布以後會比較大規模鬆綁國內生活限制，屆時指揮中心記者會也可能將不再天天開，但調整形式仍待指揮官陳時中拍板。中央流行
268	2020-05-26 21:15	《聯合早報》報導，新加坡國家傳染病中心與新加坡醫學科學院共同發表的最新研究顯示，患者染上病毒的天之後，就不再有傳染力。這項研究結論，呼應了上月在
269	2020-05-26 21:09	侵害全球，台灣靠著超前佈署，成為世界防疫楷模，政府也決定提前於解禁口罩徵收令，無論內銷、外銷都可，不過這項驚喜，卻讓不少口罩工
270	2020-05-26 20:56	蔓延期間，台灣數位政委唐鳳引起日本網友極大關注，不少報導日媒甚至以智商台灣天才大臣稱呼。沒想到，唐鳳竟然還跨界與日本新
271	2020-05-26 20:47	稅恢復以%課徵，酒精原料關稅減半措施，則將延長個月，至止。為因應防疫需要，財政部關務署日前宣布，針對有取得衛福部核發證明文件的藥用酒精原
272	2020-05-26 20:35	衝擊中國經濟活動，並導致中國當局取消發布今年的增長目標，而中國的富豪則為了避免其財富受通貨膨脹和人民幣疲軟影響，在
273	2020-05-26 20:35	中部長來新竹市，預計當天下午點開始，要請阿中部長來新竹市走走。請見，，。
274	2020-05-26 20:27	額共億，較同期票房億，減少億，退票金額億。受衝擊，報告，取消及延期演出節目數量於達高峰，截至，
275	2020-05-26 20:23	受影響，國內花卉內外銷遭受嚴重衝擊，農委會為協助花農，並刺激花卉內需，近期與南投縣政府、集集鎮公所合作，在集集火車站增加蝴蝶蘭地景
276	2020-05-26 20:16	好，加上有點乾燥，我本來就有過敏體質，導致不斷流鼻血，幸好沒有影響到比賽。受到影響，已超過個月無比賽可打，李亞軒笑說，這應該是生涯休季最長的一次
277	2020-05-26 20:09	台灣趨緩，但不少國家仍在蔓延中，醫護人員除了要不辭辛勞照顧患者，甚至還有可能遭到歧視。印度媒體報導，印度加爾各答至少有名護理師
278	2020-05-26 20:02	南非聯絡辦事處代表麥哲培代表接受，麥哲培並感謝我國的愛心善舉。曹立傑致詞，因應蔓延全球，並展現台灣是負責任的利害關係者及台灣能幫忙，而且台灣正在
279	2020-05-26 19:55	印度數百萬農民工從大城市返回家鄉後，各邦的確診人數出現上升趨勢，印度官員擔心，可能會擴散到只有基礎醫療服務的農村地區。綜合外媒報
280	2020-05-26 19:31	自爆發以來嚴重衝擊航空業，歐洲最大的航空公司德國漢莎航空也同樣在這次中面臨龐的營運壓力。對此，德國經濟部
281	2020-05-26 19:30	在全球受到新冠肺炎影響情之下，許多國際運動賽事也取消或延期，台灣隊控制得到國際稱道，讓台灣職業棒球賽事成為全球第一個開賽的職業聯盟，引起美國和日本等運
282	2020-05-26 19:20	因滯留俄羅斯的國人透過駐日代表處協助，今天搭乘日本航空撤僑包機於下午點
283	2020-05-26 19:11	國際局勢，深化台宏兩國合作關係，並希望台灣能持續分享寶貴的醫療資訊及經驗，協助宏國對抗。張惇涵說，蔡總統感謝葉德茲總統撥冗致電祝賀她的連任，也表示台灣
284	2020-05-26 19:08	後，分別於同意機組臨界，同意機組併聯。核三廠，由於大修正值的防疫期間，採取多項防範措施層層把關，在嚴格管控之下完成了燃料檢查、更換
285	2020-05-26 18:44	行政院今日召開防疫措施解禁會議，敲定解禁日期，若第個天零本土病例或社區感染，將在擴大開放國內民眾正常生活；行政院長蘇貞昌今日也在臉書發文強調，全民一起拚防疫
286	2020-05-26 18:43	表示，就算有一些國家讓學生回到學校上課，他也不會允許菲國學生在獲得疫苗之前重返校園。綜合外媒報導，菲律賓衛生部今日通報，境內武漢肺
287	2020-05-26 18:33	計不同的哏，更重要的是，讓忙碌的阿中部長休養身體，好好的補一補。請見，，。
288	2020-05-26 18:32	《日經新聞》報導，日本生技公司於昨日宣佈，疫苗開發出現進展，可啟動臨床試驗；因此消息激勵，今天股價大
289	2020-05-26 18:28	藥食同源的最早代表，也有預防癌症、降低動脈硬化、心臟疾病、維持正常免疫力等效用。值此期間，建議民眾可適度把薑入菜食用或以薑片泡茶飲用，能提升免疫力，只要
290	2020-05-26 18:21	位是外僑居留與許可者，預計抵台後，一律都要接受集中檢疫天。請見，，。
291	2020-05-26 18:18	中央流行指揮中心今日宣佈，海軍敦睦艦隊磐石軍艦官兵感染案結案，國防部稍早也召開記者會回應。軍方此次特地比照流行指揮中心，邀請新
292	2020-05-26 18:15	，突遭受徐男攻擊導致喘不過氣才不治，因此依傷害致死罪嫌將徐男起訴。由於案發當時正值延燒時，保全不明猝死，讓徐男被羈押時，台北地院還在電子看板上特別備註被
293	2020-05-26 18:13	敦睦艦隊群聚事件沒有造成帛琉和台灣的社區感染。張哲平說，敦睦支隊已經有進行防疫，但的無症狀患者實在是不容易察覺，且當時高雄地區也有零星無症狀患者、和不明感染源，但經過這次染疫案後國軍也得到經
294	2020-05-26 18:10	中央流行指揮中心今日宣布磐石艦染疫案結案，並對國防部防範等疾病，做出項建議，國軍也已採購
295	2020-05-26 18:08	高級股票基金經理則稱，美中衝突尚不是市場明顯的風險，但受影響，如美中地緣政治衝突、本土化與全球化對立、供應鏈和生產線轉移等
296	2020-05-26 17:51	高雄首艘遠洋漁船預計返回高雄港，基於防疫，將停靠前鎮漁港西岸深水碼頭內側碼頭，估計還有餘艘陸續返港。高雄市衛生局已經媒合
297	2020-05-26 17:51	敦睦艦隊磐石軍艦名官兵確診，中央流行指揮中心今宣佈此案結案。對此，國防部今日下午召開記者會說明內部調查進度，總督察長黃國明
298	2020-05-26 17:51	、美國、澳洲、俄羅斯、東南亞、中東等新市場下，成長超過%。陳吉仲，今年由於衝擊，國際航班縮減、運費成本上升，為了協助水果產業站穩海外市場，取得
299	2020-05-26 17:36	月上路、系統性重要銀行內部管理資本增提％，延後實施。金管會表示，因應對於經濟與金融市場之影響，各國政府已採行相關財政與貨幣政策等紓困措施，各
300	2020-05-26 17:35	趨緩，瑞士開始逐步解封，頂級製錶品牌愛彼於品牌發源地、瑞士汝拉山谷?
301	2020-05-26 17:26	中國衝擊全球貿易，新加坡政府決定推出第輪紓困法案，價值億美元，以應對帶來的經濟影響。據《》報導，新
302	2020-05-26 17:21	產業化發展，擴大市場規模，以提高農民收益，創造台灣農業的新價值。請見，，。
303	2020-05-26 17:18	在紓困之列。這名多歲的屏東青年，大學畢業後就到電子大廠從事第一線的工作，不料發生後公司的訂單大量減少，公司先讓員工休無薪假，接著就直接資遣員工，他在該公司服務長達，因此領到一筆
304	2020-05-26 17:14	台東縣長饒慶鈴今天說明之後的台東新旅遊，籲飯店業者不要降價，要走高端市場，勿低價競爭！縣議員李數奼今天質詢時肯定縣府在觀光業者
305	2020-05-26 17:06	進入後半場，遠距辦公雖然已成不少企業常態，但真的要完全取代實體辦公室，恐還需要一段期間適應，不過在台灣帶領微軟亞洲
306	2020-05-26 17:02	持續在俄羅斯蔓延，該國今日通報新增確診人，另有人在過去小時內死亡，此也刷新了俄羅斯單日死亡人數最高紀錄。根據《
307	2020-05-26 17:00	美國遭肆虐，多數民眾生活陷入困境，不過善心人士紛紛伸出援手，成為民生寒冬期的一股暖流，騎士中鋒卓蒙德
308	2020-05-26 16:58	月正式歇業，由於景聖樓擁有日月潭第一排的絕佳湖景，加上住房走中價位，應能撐過這波，不料卻走上歇業一途，令外界相當錯愕；潭區飯店同業則是分析，景聖樓雖
309	2020-05-26 16:54	日月潭風景區，位於湖景第一排的文武廟景聖樓飯店，本月初驚傳受影響，決定休館，資遣旗下員工，並於正式歇業，逾老字號飯
310	2020-05-26 16:47	網路名句中見端倪；今年底，台大醫院及台灣事實查核中心曾闢謠關於台大醫師團契及相關網路謠言，豈料近日，不肖人士將同樣的謠言，改冠以台大醫院教授施富金
311	2020-05-26 16:44	在歐洲逐漸趨緩，各國陸續解封，德國預計將在中旬解除個歐洲國家的旅遊警示，並計畫從起放寬社交距離規定，比原定計畫提前
312	2020-05-26 16:39	重創全球，觀光客來不了，台北觀景台瞄準國旅市場，自至期間，國人在每天上午點至下午點登上觀景台
313	2020-05-26 16:34	日本首相安倍晉三宣布，解除東京等最後個都道縣的緊急狀態，同時強調確實是由中國擴散到全世界，引發中國外交部不滿，痛批堅決反對將病毒來源問
314	2020-05-26 16:34	生組織宣布暫時中止以羥氯奎寧作為治療藥物的臨床試驗，我國中央流行指揮中心表示，原本國內在第四版臨床處
315	2020-05-26 16:32	我國雖已連續天本土零確診，解除隔離人數也達人，但面對傳染力高且途徑多元的新冠病毒，仍不可小覷。林口長庚紀念醫院兒童一般
316	2020-05-26 16:25	疫苗研發又傳出好消息，美國馬里蘭州生技公司諾瓦瓦克斯表示，該公司利用奈米顆粒技術研發的武肺疫苗，已經展開
317	2020-05-26 16:24	位在新北市鶯歌區永猷公司是這次的口罩國家隊之一，為了替社區防災、防疫努力，今天和鶯歌區公所簽署企業防災合作備忘錄。這次防疫中，
318	2020-05-26 16:23	市場調查公司今日公佈數據顯示，受影響，今年首季全球智慧型手機出貨量僅為億支，較去年首季下滑
319	2020-05-26 16:22	中央流行指揮中心今天公布海軍敦睦艦隊磐石艦的群聚感染事件，從第例不明感染源在發病後，一路經歷波傳染到中旬下船，指
320	2020-05-26 16:16	是提供資金明細即可貸款，林崇傑表示，這部分會再向台南市政府詢問。請見，，。
321	2020-05-26 16:15	高雄市潘姓男子間在流行當頭，轉傳通訊軟體外國人捷運吐口水不實貼圖，製造恐慌，使社會大眾不安，橋頭地檢署予以緩起
322	2020-05-26 16:03	海軍敦睦艦隊磐石艦群聚感染事件結案，確定有波感染，且第名感染者至今找不出感染源；中央流行指揮中心專家小組召集人張上淳說，經病毒
323	2020-05-26 15:57	儀式，特別轉身摘掉口罩致詞感謝高雄勞工，也呼籲企業主更重視勞工健康，市府人士透露，這是以來，韓國瑜首次脫掉口罩於公開場合致詞。韓國瑜原戴口罩上台，特地轉身
324	2020-05-26 15:56	中央流行指揮中心今日下午召開記者會說明，敦睦艦隊磐石軍艦官兵罹患案已結案，由於國防部日前由軍政副部長張哲平上將籌組調查小組，並透過面訪方
325	2020-05-26 15:51	儘管衝擊全球，無損金融股王上海商銀第一季的獲利表現。上海銀第一季稅後淨利歸屬母公司業主億元、年增%，
326	2020-05-26 15:48	業績受香港反送中抗爭和衝擊的香港國泰航空，傳出可能合併國泰港龍
327	2020-05-26 15:48	，但開放寺廟進行人左右的區域性遶境，對於參加人員較可掌握。請見，，。
328	2020-05-26 15:30	有破損現象，希望早日完成規劃完成，並加速工程發包，如期如質完工，以優質的休憩環境，迎接趨緩後的旅遊人潮。縣長饒慶鈴強調，蘭嶼鄉以其獨特的自然景觀吸引遊客
329	2020-05-26 15:25	受到趨緩，基隆市長林右昌今天表示，將與桃園市合作，共推和平安心遊、作伙來基桃雙城旅遊。林右昌表示，除了桃園市，基隆市正在與其
330	2020-05-26 15:22	必須要慎重，至於鄰近亞洲國家的開放部分，也會再進行大方向的討論。請見，，。
331	2020-05-26 15:19	，這場鬥爭的最終結局將會是雙輸。《》報導，艾利森，美中經濟皆受到的肆虐，雙方領導人川普及習近平正致力控制住國內。但他警告，
332	2020-05-26 15:18	席捲全球，台灣防疫成績深受肯定，宜蘭縣家民宿業者，提供近間房間招待防疫人員住宿，藉此表達誠摰謝意。活
333	2020-05-26 15:16	紅十字會今日公開一封信件，呼籲停止在期間對醫療保健、醫學研究機構的網路攻擊，多名政治、商業人士也連署響應。《路透》報導，
334	2020-05-26 15:14	場熱氣球光雕音樂會，都將接力在大坡池登場，歡迎全國鄉親結伴同歡。請見，，。
335	2020-05-26 15:11	肆虐全球，坊間抗病毒偏方也從沒停過，國內社群最常流傳的抗疫偏方是茶、鹽水、大蒜、韭菜等；而隨著風土民情不同，國外的偏方則有吃素、避
336	2020-05-26 15:06	社會脫節，強調現金是民眾小額消費最常使用的，衛生局也表示目前北市查無因現金交易導致感染的案件，批評柯市府閉門造車、不懂市民日常生活。王世堅質詢時秀出其助理到健康中心購買口罩情形，他，市府
337	2020-05-26 15:04	登山步道，特愛走人煙稀少的獸徑探險。據了解，歲李姓遊覽車司機家住淡水，年初因為爆發肺炎，生意大受影響，為了貼補家用，到大屯山系採箭筍後，就失聯，家屬心急如焚，晚間起正式通報
338	2020-05-26 15:02	、日本人配偶和留學等居留資格者原則上也列入拒絕入境對象。請見，，。
339	2020-05-26 15:02	台灣稍歇，已多日無本土及確診案例，進入後時代，澎湖縣政府旅遊處為搶攻這波觀光商機，推出壓箱寶、年底才揭開神秘面紗的銅牆鐵壁
340	2020-05-26 15:01	日本的緩和，讓日本職棒決定復賽、閉門開打，最少打場。日媒《日刊體育》預測支球團的開幕戰先發陣容中，火腿隊
341	2020-05-26 14:56	台北流行音樂中心北基地表演廳預定今年正式營運，不過開幕受影響，北流將規劃梅花座的開幕，讓觀眾可以保持社交距離。台北流行音樂
342	2020-05-26 14:52	為遏止擴散，南韓政府先前實施居家令，令線上影音串流平台受益。南韓數據分析公司今日公佈數據顯示，訂閱
343	2020-05-26 14:49	亞太經合會明將針對召開虛擬特別會議。外交部今表示，我方將在會中分享台灣模式防疫經驗
344	2020-05-26 14:46	、公平交易等法規做把關，因此相關行為或哄抬物價都是不被允許。請見，，。
345	2020-05-26 14:44	受外界關注、由富士軟片子公司開發的法匹拉韋做為的用藥。但該計畫現傳出現變數，有日本官員透露，日本政府已放棄在本月底前，批准做為
346	2020-05-26 14:44	肆虐全球，國際間對中國觀感轉趨負面，針對亞裔面孔的歧視現象也逐漸浮現。美國有線電視新聞網台裔記者娜塔莎陳
347	2020-05-26 14:41	逐漸趨緩，台灣已連無本土案例，日本東京每日確診人數也降至個位數，不過，受影響而改變的工作、生活型態可能將延續，國泰
348	2020-05-26 14:38	為了守住零確診成果，鹿港慶端陽龍舟賽將鎖小規模舉辦，登場的龍王祭將一切從簡，龍舟踩街也將減為艘，明天起一連天將首
349	2020-05-26 14:37	永豐金控今天下午舉行法說會。受到影響，永豐金表示，今年第一季稅後盈餘億元，較去年同期衰退％，不過，在銀行、證
350	2020-05-26 14:25	艦比起來相對較低，研判是船艦上有戴口罩，因此讓感染率低很多。請見，，。
351	2020-05-26 14:23	組織，檢方聲請法官，在判刑之外，宣告執行結束後，強制工作。請見，，。
352	2020-05-26 14:21	家庭未來將和其他人擁有相同的權利。本月曾有多名保守派議員試圖提出一項動議，以等問題為由，議員並沒有足夠時間審查，欲將裁決再推遲個月，但最終未獲得
353	2020-05-26 14:16	國內今日仍無新增，指揮官陳時中表示，國外嚴峻，但國內已連續天本土零確診，解除隔離已達人。陳時中，今日在行政院
354	2020-05-26 14:13	海軍磐石艦隊群聚感染事件共名確診、名極可能病例；中央流行指揮中心今天公布磐石艦調查，確認有波人傳人，且確定
355	2020-05-26 14:12	延燒，南韓目前累計例確診、人死亡。為了防止大流行，南韓政府先前表示，針對違反居家隔離者，將祭出最重徒刑或最高
356	2020-05-26 14:09	兩年一次的台灣國際工具機展預計今年中於台中登場，但受衝擊，廠商對於是否如期舉辦各有意見，工具機公會今召開推動小組會
357	2020-05-26 14:00	推升數位金融使用量，國泰世華銀行擁有超過萬數位用戶，在中，首季數位交易量大幅上升，包括行動銀行登入次數，為去年同期
358	2020-05-26 13:59	全球趨緩，各國都在思考解封策略，台大公衛學院今提解封指數，透過確診、康復與致死率等判斷，當指數低於應可解封邊境管制等，
359	2020-05-26 13:47	因應造成各產業衝擊，中央推振興券初步定案為每人支付元換元，桃園市表示配合中央政策，桃園市府將加碼元電子抵用券
360	2020-05-26 13:46	肆虐全球，全台聞色變。陸姓男子竟在上造謠行政院全台縣市明起強制放假兩個星期，被警方依違反社會秩序法究辦。基隆地
361	2020-05-26 13:45	重創全球航空業，繼拉丁美洲第大航空公司哥倫比亞航空控股公司聲請破產後，拉丁美洲最大航空公司
362	2020-05-26 13:43	物為生的中低收入戶、身心障礙或弱勢家庭優先錄取，協助環境整潔、清潔隊資源回收工作，因應，起每位資收大軍的補助從每月元加碼到元。環保局
363	2020-05-26 13:43	業典禮，在做好防疫措施下，也歡迎家長到學校分享孩子的榮耀與喜悅。請見，，。
364	2020-05-26 13:41	在全球大流行，多國實施防疫居家禁足令，似乎讓中國字節跳動的影音平台抖音成為最大贏家。數據公
365	2020-05-26 13:40	市府與議員們一同努力，讓市民朋友生活盡快回到正軌、共創幸福高雄。請見，，。
366	2020-05-26 13:35	美中關係持續緊繃，隨著疫苗出現進展，雙方口水戰亦不停歇，繼美國國家安全顧問歐布萊恩
367	2020-05-26 13:31	揮中心發言人莊人祥說，確定本週六、日要到台南，但行程還未確定。請見，，。
368	2020-05-26 13:19	已逾千人，離開利比亞的人數有所上升，但搜救、救援能力卻急遽下降。綜合外媒報導，由於影響，利比亞在就關閉機場，並限制邊境的人口流動，但本月仍有超過千人試
369	2020-05-26 13:11	有生產履歷，民眾帶回家吃得安心，也可捐贈廟方救助弱勢需要的民眾，一舉多得。此外，影響農產品出口，大安區農會特別向外埔區青農購買文心蘭，響應農委會以花代
370	2020-05-26 13:07	因應國內趨緩，行政院今日召開防疫措施解禁會議，商討各方面活動的鬆綁時機；行政院長蘇貞昌在聽取各部會意見後強調，原則就是邊境風險嚴管，國內鬆綁。若能順利度過第個
371	2020-05-26 13:00	流行指揮中心指揮官陳時中昨宣布，口罩解禁預計起實施。另外，國內昨日仍無新增病例，已經連續天本土零確診。目前國內累計例確診，人解
372	2020-05-26 12:53	全球逾萬人感染，台中市立中港高中為了替在醫療第一線默默付出的白衣戰士加油打氣，發起送愛給醫護人員活動，學生寫下感謝醫護人員的
373	2020-05-26 12:43	為紓緩所造成衝擊，南市交通局針對公有委外停車場經營業者祭出紓困措施，減收今年至經營權利金，協助業者度難關，至於後續將視再
374	2020-05-26 12:41	趨緩，一再+，不少大廠啟求才，為後時代拚經濟儲備能量，世界級封測大廠矽品精密工業去年以億元加碼投資台中，擴建中部
375	2020-05-26 12:20	國內趨緩，中央流行指揮中心擬從起改採定額徵收口罩，餘量開放廠商自由買賣，消息傳出，國內老牌醫療口罩大廠中衛公司詢問電話
376	2020-05-26 12:09	俄羅斯嚴峻，滯俄名國人與名俄籍配偶搭乘日航班機撤離，預計在今天傍晚返抵國門。外交部今對俄羅斯及日本相關單位及日本航空提供的各
377	2020-05-26 12:08	省很多時間。日本政府發言人、官房長官菅義偉在今天的例行記者會中也對於此事表示，這是期間，日本、台灣、俄羅斯合作的一個好例子。他表示，這架包機主要是為了
378	2020-05-26 12:06	仍需進一步討論後，也會參考與居民意見，確定後會統一公布。請見，，。
379	2020-05-26 12:05	中南美洲漸成中心，巴西確診數更是一舉竄至全球第二多，達萬件。巴西總統波索納洛因輕忽遭外界
380	2020-05-26 12:01	受到衝擊，全國舞廳酒店停業，隨著嘉玲持續報到，台中市宣布有條件讓台中酒店與舞廳解封；台中市經發局統計，截至中午，全市家
381	2020-05-26 12:00	儘管不少企業因打亂了營運步調，但中華開發文教基金會的教育工程並未停歇，技藝職能獎學金持續徵件，藉此培育青年學子獲得一技之
382	2020-05-26 11:57	是老人的運動，而是年輕人。我一直在訓練，即便現在沒有比賽，我仍努力保持鍛鍊。因影響全球，也打亂柯隆今年的計畫，他原本要在打墨西哥聯盟，但比賽
383	2020-05-26 11:55	衝擊，苗栗家扶中心民生物資募集量銳減，弱勢家庭生計也大受影響，經媒體報導後，群聯電子股份有限公司號召員工捐善款，短短天就集資萬，
384	2020-05-26 11:54	協議，同意在今年至期間，每日減產萬桶原油，以支撐因而暴跌的油價。諾瓦克表示，到目前為止，全球的石油生產商每日已將全球石油產量減少萬至
